{
	"$schema": "https://json-schema.org/draft/2020-12/schema",
	"$id": "https://github.com/michaelshimeles/bible-rs/objects/object.schema.json",
	"$comment": "SPDX-License-Identifier: CC-BY-4.0 (objects/LICENSE)",
	"title": "A Bible object built from the text",
	"description": "One object (objects/<id>.json): its parts, every number in cubits with the verse it comes from, and whether each is stated in the text or an interpretive choice. objects/README.md explains each field.",
	"type": "object",
	"additionalProperties": false,
	"required": ["id", "slug", "title", "summary", "license", "sources", "unit", "parts", "assembly"],
	"properties": {
		"$schema": { "type": "string" },
		"id": { "$ref": "#/$defs/id" },
		"slug": {
			"description": "The page's address on the site, /<slug>.",
			"type": "string",
			"pattern": "^[a-z0-9]+(-[a-z0-9]+)*$"
		},
		"title": { "type": "string", "minLength": 1 },
		"summary": { "description": "One sentence on what the object is.", "type": "string", "minLength": 1 },
		"license": { "description": "The spec's license: CC BY 4.0, as for everything in objects/ (objects/LICENSE).", "const": "CC-BY-4.0" },
		"sources": {
			"description": "The passages that describe the object, as OSIS references or ranges. The reader shows the object's glyph after the first verse of each.",
			"type": "array",
			"minItems": 1,
			"items": { "$ref": "#/$defs/range" }
		},
		"unit": { "description": "The unit of every length in the file.", "const": "cubit" },
		"parts": {
			"type": "array",
			"minItems": 1,
			"items": { "$ref": "#/$defs/part" }
		},
		"assembly": {
			"description": "\"Build from the text\": the order the parts appear in, each with the verse shown as its caption.",
			"type": "array",
			"minItems": 1,
			"items": {
				"type": "object",
				"additionalProperties": false,
				"required": ["part", "ref"],
				"properties": {
					"part": { "$ref": "#/$defs/id" },
					"effect": {
						"description": "What the step does to a part already built, instead of bringing it in: gild turns its wood to gold.",
						"enum": ["gild"]
					},
					"ref": { "$ref": "#/$defs/ref" }
				}
			}
		}
	},
	"$defs": {
		"id": { "type": "string", "pattern": "^[a-z0-9]+(-[a-z0-9]+)*$" },
		"ref": {
			"description": "One verse as an OSIS reference: Exod.25.10.",
			"type": "string",
			"pattern": "^[1-3]?[A-Z][a-z]+\\.[1-9][0-9]*\\.[1-9][0-9]*$"
		},
		"range": {
			"description": "A verse or a run of verses in one chapter: Exod.25.10 or Exod.25.10-22.",
			"type": "string",
			"pattern": "^[1-3]?[A-Z][a-z]+\\.[1-9][0-9]*\\.[1-9][0-9]*(-[1-9][0-9]*)?$"
		},
		"quote": {
			"description": "The words of the verse that state the fact, exactly as the repository's KJV and BSB have them. The check finds each in its verse.",
			"type": "object",
			"additionalProperties": false,
			"required": ["kjv", "bsb"],
			"properties": {
				"kjv": { "type": "string", "minLength": 3 },
				"bsb": { "type": "string", "minLength": 3 }
			}
		},
		"fact": {
			"description": "Something the text says about a part, with the verse that says it.",
			"type": "object",
			"additionalProperties": false,
			"required": ["text", "ref", "quote"],
			"properties": {
				"text": { "type": "string", "minLength": 1 },
				"ref": { "$ref": "#/$defs/ref" },
				"quote": { "$ref": "#/$defs/quote" }
			}
		},
		"dim": {
			"description": "A number. Stated in the text: interpretive false, with the verse and the words that give it. An interpretive choice: interpretive true, with a note saying why; a ref is optional.",
			"type": "object",
			"additionalProperties": false,
			"required": ["value", "interpretive"],
			"properties": {
				"value": { "type": "number", "exclusiveMinimum": 0 },
				"unit": {
					"description": "cubit (the default) or count.",
					"enum": ["cubit", "count"]
				},
				"interpretive": { "type": "boolean" },
				"ref": { "$ref": "#/$defs/ref" },
				"quote": { "$ref": "#/$defs/quote" },
				"note": { "type": "string", "minLength": 1 }
			},
			"if": { "properties": { "interpretive": { "const": false } } },
			"then": { "required": ["ref", "quote"] },
			"else": { "required": ["note"] }
		},
		"choice": {
			"type": "object",
			"additionalProperties": false,
			"required": ["id", "label", "note", "values"],
			"properties": {
				"id": { "$ref": "#/$defs/id" },
				"label": { "type": "string", "minLength": 1 },
				"note": { "type": "string", "minLength": 1 },
				"values": {
					"description": "The numbers this choice sets, by name.",
					"type": "object",
					"additionalProperties": { "$ref": "#/$defs/dim" }
				}
			}
		},
		"option": {
			"description": "A debated choice: every reading is listed, one is the default, and the viewer can switch between them.",
			"type": "object",
			"additionalProperties": false,
			"required": ["id", "label", "default", "choices"],
			"properties": {
				"id": { "$ref": "#/$defs/id" },
				"label": { "type": "string", "minLength": 1 },
				"default": { "$ref": "#/$defs/id" },
				"choices": { "type": "array", "minItems": 2, "items": { "$ref": "#/$defs/choice" } }
			}
		},
		"part": {
			"type": "object",
			"additionalProperties": false,
			"required": ["id", "label", "interpretive", "note", "facts", "dims", "model"],
			"properties": {
				"id": { "$ref": "#/$defs/id" },
				"label": { "type": "string", "minLength": 1 },
				"interpretive": {
					"description": "true when the part's form goes beyond what the text gives (it is labelled Interpretive choice); false when the text gives its form.",
					"type": "boolean"
				},
				"note": { "description": "What the text gives and what the model adds.", "type": "string", "minLength": 1 },
				"facts": { "type": "array", "minItems": 1, "items": { "$ref": "#/$defs/fact" } },
				"dims": {
					"description": "The part's numbers, by name, in cubits unless their unit says otherwise.",
					"type": "object",
					"additionalProperties": { "$ref": "#/$defs/dim" }
				},
				"options": { "type": "array", "items": { "$ref": "#/$defs/option" } },
				"model": {
					"description": "How the part is drawn: procedural:<generator> (geometry made in code from the dims), or a glTF file under models/ with its author and license.",
					"oneOf": [
						{ "type": "string", "pattern": "^procedural:[a-z]+$" },
						{
							"type": "object",
							"additionalProperties": false,
							"required": ["file", "author", "license"],
							"properties": {
								"file": { "type": "string", "pattern": "^models/.+\\.glb$" },
								"author": { "type": "string", "minLength": 1 },
								"license": { "type": "string", "minLength": 1 }
							}
						}
					]
				}
			}
		}
	}
}
